artista,genero,tipo,nombre,año_lanzamiento,id,bio,oyentes,reproducciones,similar_1,similar_2,similar_3
Chano Lobato,tango,track,Tango (De carnaval),2000,4cEIOtSaJoY1FYbZ51ZwBT," <a href=""https://www.last.fm/music/Chano+Lobato"">Read more on Last.fm</a>",11114,41833,Antonio Mairena,Marina Heredia,El Lebrijano
Franz Schubert,tango,track,Tango Serenata (Ständchen),2000,1t91qQaPbOoo4pumaLih4W,"Franz Peter Schubert (31 January 1797 – 19 November 1828) was an Austrian composer of the late Classical and early Romantic eras. Despite his short life, Schubert left behind a vast oeuvre, including more than 600 secular vocal works (mainly lieder), seven complete symphonies, sacred music, operas, incidental music, and a large body of piano and chamber music. His major works include the art songs Erlkönig, Gretchen am Spinnrade, Ave Maria; the Trout Quintet, the unfinished Symphony No. <a href=""https://www.last.fm/music/Franz+Schubert"">Read more on Last.fm</a>",1402472,17131975,Robert Schumann,Ludwig van Beethoven,Johannes Brahms
Gotan Project,tango,track,Last tango in Paris,2000,21t8hRnA30ENadkEAHjYWs,"Gotan Project is an electrotango group based in Paris, consisting of Frenchman Philippe Cohen Solal, Eduardo Makaroff from Argentina, and Christoph H. Müller, from Switzerland and a former member of Touch El Arab. They formed in 1999. Their first release was Vuelvo Al Sur/El Capitalismo Foráneo in 2000, followed by the album La Revancha del Tango in 2001. Their music is clearly tango, but also uses electronic elements such as samples, beats and breaks. <a href=""https://www.last.fm/music/Gotan+Project"">Read more on Last.fm</a>",750790,15921317,Bajofondo,Otros Aires,Federico Aubele
Tomaso Albinoni,tango,track,Tango Adagio,2000,3dVVMsZCVGxce42Nd9a0XC,"Tomaso Giovanni Albinoni (1671–1751) was a Venetian Baroque composer. While famous in his day as an opera composer, he is mainly remembered today for his instrumental music, some of which is regularly recorded. His “Adagio in G minor”, actually a later reconstruction, is one of the most frequently recorded pieces of Baroque music. Born to Antonio Albinoni (1634–1709), a wealthy paper merchant and nobleman in Venice, he studied violin and singing. <a href=""https://www.last.fm/music/+noredirect/Tomaso+Albinoni"">Read more on Last.fm</a>",145009,864126,Arcangelo Corelli,Georg Philipp Telemann,Georg Friedrich Händel
Niña Pastori,tango,track,Tangos de la Tía Juana,2000,1Db2TgZ8820Lc4bfSpZv9h,"Niña Pastori is a Spanish flamenco singer (cantaora). She was born María Rosa García García in San Fernando (Cádiz) on 15 January 1978. The youngest of five siblings and only daughter of a military man (José) and gypsy flamenco singer La Pastori, she started her artistic career at a very young age. By the time she was six, she was accompanying her mother to the flamenco tablaos of her neighborhood, ""el Boquete"". A year later she won a contest in San Fernando <a href=""https://www.last.fm/music/+noredirect/Ni%C3%B1a+Pastori"">Read more on Last.fm</a>",130892,1024873,El Barrio,Ketama,Rosario
Juana Amaya,tango,track,Tangos con Guitarra = 144,2000,7bHTT2cLbqRahTzjIuQdOd," <a href=""https://www.last.fm/music/Juana+Amaya"">Read more on Last.fm</a>",419,3538,Jose Galvan,Manuel Salado,Adela Campallo
El Luis,tango,track,Tangos Árabes,2000,6fmrnaJd2NGpfBqNj5SxrG," <a href=""https://www.last.fm/music/El+Luis"">Read more on Last.fm</a>",692,3653,Los Amaya,Los Calis (F),Parrita
Juana Amaya,tango,track,Tangos Solo Compás = 120,2000,5ZTy9KynO3xK316i7ZRJXQ," <a href=""https://www.last.fm/music/Juana+Amaya"">Read more on Last.fm</a>",419,3538,Jose Galvan,Manuel Salado,Adela Campallo
El Luis,tango,track,Tangos Del Argentino,2000,381LwmkqwTfLSw0qZYyEPF," <a href=""https://www.last.fm/music/El+Luis"">Read more on Last.fm</a>",692,3653,Los Amaya,Los Calis (F),Parrita
Niña Pastori,tango,track,Tangos de la Tía Juana,2000,2f498CgDHl0GM3EH889GIv,"Niña Pastori is a Spanish flamenco singer (cantaora). She was born María Rosa García García in San Fernando (Cádiz) on 15 January 1978. The youngest of five siblings and only daughter of a military man (José) and gypsy flamenco singer La Pastori, she started her artistic career at a very young age. By the time she was six, she was accompanying her mother to the flamenco tablaos of her neighborhood, ""el Boquete"". A year later she won a contest in San Fernando <a href=""https://www.last.fm/music/+noredirect/Ni%C3%B1a+Pastori"">Read more on Last.fm</a>",130892,1024873,El Barrio,Ketama,Rosario
José Antonio Ramos,tango,track,Tango de la Florida,2000,5DGsrGvmNMP0Woe0dkHVAW,"José Antonio Ramos is an artist from the Canary Isles who has introduced the timple in a completely new acoustic field. His incursions in several genres (jazz, flamenco, Celtic, symphonic, etc) have caused admiration in everyone that have listen his work and his new proposals. José Antonio Ramos was born in Las Palmas de Gran Canaria (Canary Isles) in November 10th, 1969. At the age of nine he started his timple studies with Totoyo Millares. Later <a href=""https://www.last.fm/music/+noredirect/Jos%C3%A9+Antonio+Ramos"">Read more on Last.fm</a>",523,7379,Benito Cabrera,Los Gofiones,Mestisay
Juana Amaya,tango,track,Tangos con Guitarra = 152,2000,71kMJevhJhRo6mSui73uHN," <a href=""https://www.last.fm/music/Juana+Amaya"">Read more on Last.fm</a>",419,3538,Jose Galvan,Manuel Salado,Adela Campallo
Athens Symphony Orchestra,tango,track,Tango,2000,6YtkNPtJGDfueeBYl26lM8," <a href=""https://www.last.fm/music/+noredirect/Athens+Symphony+Orchestra"">Read more on Last.fm</a>",2221,6784,Selva Erdener,Domna Samiou,Ta Paidia Ap'tin Patra
Juana Amaya,tango,track,Tangos Solo Compás = 144,2000,1q7aqBND3hqiHvjDqel3rc," <a href=""https://www.last.fm/music/Juana+Amaya"">Read more on Last.fm</a>",419,3538,Jose Galvan,Manuel Salado,Adela Campallo
Juana Amaya,tango,track,Tangos Solo Compás = 152,2000,4aoujIHeWRKT2hsIpX1I0w," <a href=""https://www.last.fm/music/Juana+Amaya"">Read more on Last.fm</a>",419,3538,Jose Galvan,Manuel Salado,Adela Campallo
Amusic Skazz Band,tango,track,Tango Para Marcelo,2000,5OwLhPBYUXJvgmeEqbBxwo,"Group that practices Jamaican Jazz or Ska Jazz, a style created and popularized by the legendary Skatalites in the 60s in Jamaica, and which differs from classical Jazz by incorporating the setback marked by the guitar. <a href=""https://www.last.fm/music/Amusic+Skazz+Band"">Read more on Last.fm</a>",1542,16889,Skaks,Alpha Boys School,La Thorpe Brass
Michel Camilo,tango,track,Aire De Tango,2000,3DcmYIYLpSK1AlVMIyZshk,"Michel Camilo (born April 4, 1954) is a pianist and composer from Santo Domingo, Dominican Republic. He is known as a great jazz, latin and classical pianist with superb technical ability, and has played and recorded with many world-famous musicians. Michel lists some of his main influences as Chick Corea, Keith Jarrett, Oscar Peterson, Bill Evans, and Art Tatum. Michel was born into a musical family and as a young child showed great aptitude for the accordion that his parents gave him. <a href=""https://www.last.fm/music/Michel+Camilo"">Read more on Last.fm</a>",103977,991675,Michel Petrucciani,Chucho Valdés,Gonzalo Rubalcaba
Johann Sebastian Bach,tango,track,Tango Aria (Air on the G String),2000,0MJgtHcv1Wjv4Wxc9nJATo,"Johann Sebastian Bach (31 March 1685 – 28 July 1750) was a German composer and musician of the late Baroque period. He composed a wide range of music across various instruments and forms, including orchestral works such as the Brandenburg Concertos; solo instrumental pieces like the cello suites and the sonatas and partitas for solo violin; keyboard compositions including the Goldberg Variations and The Well-Tempered Clavier; organ works such as <a href=""https://www.last.fm/music/Johann+Sebastian+Bach"">Read more on Last.fm</a>",2410083,93325190,Ludwig van Beethoven,Wolfgang Amadeus Mozart,Georg Friedrich Händel
Jesus Heredia,tango,track,Tangos Trianeros Gitanos,2000,5J892zpNVFHgbTPiC1GDAb," <a href=""https://www.last.fm/music/Jesus+Heredia"">Read more on Last.fm</a>",310,806,Jose Galan,Placido Gonzalez,Jose De La Tomasa
King Putreak,tango,track,Tango del Tongao,2000,4siItqfRh1zAFSANpnFcsp," <a href=""https://www.last.fm/music/King+Putreak"">Read more on Last.fm</a>",723,6591,King Putreak & The Vientre,huevos canos,El Sombrero Del Abuelo
Juana Amaya,tango,track,Tangos Solo Compás = 166,2000,4DskXDzXGAZALcNCoWjESh," <a href=""https://www.last.fm/music/Juana+Amaya"">Read more on Last.fm</a>",419,3538,Jose Galvan,Manuel Salado,Adela Campallo
Lole Y Manuel,tango,track,Tangos de la Pimienta,2000,3t8wNUARbCyo7SJqkD8wrl,"Dolores Montoya Rodriguez (""Lole,"" born in Sevilla, 1954) and Manuel Molina Jimenez (""Manuel,"" born in Ceuta, 1948) are a flamenco duo that started, as a project, in 1972. The couple was the first flamenco couple ever to target an audience not familiar with flamenco, and are precursors of ""nuevo flamenco"" (New Flamenco). Their first album was produced in 1975, with a title representative of Spain's social realities at the time: ""Nuevo dia"" (New Day). <a href=""https://www.last.fm/music/Lole+Y+Manuel"">Read more on Last.fm</a>",118084,668557,Enrique Morente,Camarón de la Isla,Estrella Morente
Vicente Amigo,tango,track,Compare Manuel (Dedicado a Queco) - Tangos,2000,2wiP5IZgD2ICYaeCfpyBvR,"Vicente Amigo (born 1967, Guadalcanal) is a Spanish flamenco guitarist, singer and composer. He was raised in Cordoba where he studied guitar playing, most famously under Manolo Sanlúcar, a renowned flamenco guitarist with whom he worked for ten years. Amigo gained high regard in the flamenco scene at a relatively young age. He is considered by many the crown prince of the great flamenco guitarist Paco de Lucía, who is considered the father of modern flamenco guitar playing. <a href=""https://www.last.fm/music/Vicente+Amigo"">Read more on Last.fm</a>",127891,1133466,Paco de Lucía,Tomatito,Estrella Morente
Juana Amaya,tango,track,Tangos Solo Compás = 108,2000,4LPTkzQbUljf2JXd9ziKsh," <a href=""https://www.last.fm/music/Juana+Amaya"">Read more on Last.fm</a>",419,3538,Jose Galvan,Manuel Salado,Adela Campallo
Familia Montoya,tango,track,Tangos de Mi Abuela,2000,2QZAaai9zMW0qAjavzwxhv," <a href=""https://www.last.fm/music/Familia+Montoya"">Read more on Last.fm</a>",94,533,El Agujetas,Fernanda de Utrera,Ramón El Portugués
Mara Rey,tango,track,Tangos. Sólo Cante por Mara Rey,2000,2tlrrd2LACW3EnYeWepDoP," <a href=""https://www.last.fm/music/Mara+Rey"">Read more on Last.fm</a>",14,39,,,
Galt MacDermot,tango,track,Tango,2000,0htJBxWiYQekDfaXfpZIOR,"Arthur Terence Galt MacDermot (December 18, 1928 – December 17, 2018) was a Canadian-American composer, pianist and writer of musical theatre. He won a Grammy Award for the song ""African Waltz"" in 1960. His most successful musicals were Hair (1967; its cast album also won a Grammy) and Two Gentlemen of Verona (1971). MacDermot also composed music for film soundtracks, jazz and funk albums, and classical music, and his music has been sampled in hit hip-hop songs and albums. <a href=""https://www.last.fm/music/Galt+Macdermot"">Read more on Last.fm</a>",311938,3120742,Menahan Street Band,Lack of Afro,The Olympians
Luis Villegas,tango,track,Last Tango,2000,186rs21ykuTNwgb4nYPwFE,"Luis Villegas is a first-generation Mexican-American born in East Los Angeles, CA and is now an Internationally-renowned guitarist. A self-taught guitarist who plays flamenco, jazz, rock, blues and classical, he grew up listening to traditional Mexican Ranchero music. As a boy, he met the famous Mexican Ranchero singer, Vicente Fernandez, and listened to traditional Mexican ballads. It was not Mexican music, however, that attracted him to the guitar but rock and roll since the heavy metal explosion was in full swing in Los Angeles. <a href=""https://www.last.fm/music/Luis+Villegas"">Read more on Last.fm</a>",13466,72417,Saro Tribastone,NOVAMENCO,Creol
Juana Amaya,tango,track,Tangos Solo Compás = 176,2000,3uuoetoTPJkEIjyHxDGDyd," <a href=""https://www.last.fm/music/Juana+Amaya"">Read more on Last.fm</a>",419,3538,Jose Galvan,Manuel Salado,Adela Campallo
Lole Y Manuel,tango,track,Tangos del Almendro,2000,5ZIrzjYNq6C5Dl7HUZBBSD,"Dolores Montoya Rodriguez (""Lole,"" born in Sevilla, 1954) and Manuel Molina Jimenez (""Manuel,"" born in Ceuta, 1948) are a flamenco duo that started, as a project, in 1972. The couple was the first flamenco couple ever to target an audience not familiar with flamenco, and are precursors of ""nuevo flamenco"" (New Flamenco). Their first album was produced in 1975, with a title representative of Spain's social realities at the time: ""Nuevo dia"" (New Day). <a href=""https://www.last.fm/music/Lole+Y+Manuel"">Read more on Last.fm</a>",118084,668557,Enrique Morente,Camarón de la Isla,Estrella Morente
Familia Montoya,tango,track,Tangos de la Virgen,2000,5Svp0XLKao9MwaovhTr9GY," <a href=""https://www.last.fm/music/Familia+Montoya"">Read more on Last.fm</a>",94,533,El Agujetas,Fernanda de Utrera,Ramón El Portugués
Antonio Vivaldi,tango,track,Primavera Tango (Four Seasons),2000,6mpQYMq1l1gU0ltQ0nO1IW,"Antonio Lucio Vivaldi (4 March 1678 – 28 July 1741) was an Italian composer, virtuoso violinist, impresario of Baroque music, and Roman Catholic priest. He is regarded as one of the leading Baroque composers, with a significant influence across Europe during his lifetime. Vivaldi contributed to developments in orchestration, violin technique, and programmatic music. He played a key role in consolidating the concerto form, particularly the solo concerto, into a widely recognised musical idiom. <a href=""https://www.last.fm/music/Antonio+Vivaldi"">Read more on Last.fm</a>",1889232,40695234,Georg Friedrich Händel,Johann Sebastian Bach,Georg Philipp Telemann
Candeal,tango,track,Tango Del Borracho,2000,1xsUy44UXm3sgS8HhHANX1,"Candeal, including: Félix Pérez[/bandember], Toño Ortega, Nico, Alfonso Gato, Antonio, Mário Garrote, is a Spanish group who for 30 years has played and recompiled the traditional folk songs of their native Spain, making their own traditional and antique instruments, and giving concerts throughout Spain and internationally in venues ranging from music conservatoria to great concert halls and even television. They have recorded 20 albums and received various awards for their work. Official site www.grupocandeal.es <a href=""https://www.last.fm/music/Candeal"">Read more on Last.fm</a>",599,9305,Nuevo Mester de Juglaría,Joaquín Díaz,Nuevo Mester Juglaria
Vicky Leandros,tango,track,Tango d'amour,2000,7LPxuZcGoUtJ7O5c1Bjy7G,"Vasiliki Papathanasiou (Greek: Βασιλική Παπαθανασίου, IPA: [vasiliˈci papaθanaˈsi.u]; born 23 August 1949), generally known as Vicky Leandros (Greek: Βίκυ Λέανδρος, IPA: [ˈvici ˈle.anðros]), is a Greek singer living in Germany. She is the daughter of singer, musician, and composer Leandros Papathanasiou (also known as Leo Leandros and Mario Panas as well). In 1967, she achieved worldwide fame after securing fourth <a href=""https://www.last.fm/music/Vicky+Leandros"">Read more on Last.fm</a>",81335,628924,Roy Black,Marianne Rosenberg,Katja Ebstein
Dead Fish,tango,track,Tango,2000,7e37qaZzqbd2rJYk9CZrol,"There is more than one artist with this name: 1) Dead Fish is a Brazilian hardcore punk band from Vitória, Espírito Santo, Brazil. Formed in 1991, they developed their music with intense vocal, initially sung in English then switched to Portuguese, frantic guitar fretwork, bulldozer-like drumming style and bass picking. The lyrics usually range from political and social criticism to daily personal problems, among others. Their gigs are known for the energetic performances, frantic mosh-pit and stage dives. <a href=""https://www.last.fm/music/Dead+Fish"">Read more on Last.fm</a>",108071,11025156,Sugar Kane,Pense,Zander
Ramon Montoya,tango,track,Tango - mayor y menor,2000,5A8FVt6fFmsXIRVIYD4iEG," <a href=""https://www.last.fm/music/+noredirect/Ramon+Montoya"">Read more on Last.fm</a>",449,4211,Niño Ricardo,Ronald Radford,Juan Martín
Francisco Canaro,tango,track,Tangon,2000,76ykNl4JXqmC2IFR0qm04U,"Francisco Canaro (November 26, 1888 – December 14, 1964) was an Uruguayan violinist and tango orchestra leader. Known as ""Pirincho"" Canaro, he had a career that spanned many decades, and his orchestra was one of the most recorded. Much of his recorded music is in the classic salon style of the 1940s, but he is also considered a member of the old guard, and some of his later recordings contributed to the transition to concert tango. For many contemporary dancers and listeners, his early golden age recordings are the best. <a href=""https://www.last.fm/music/Francisco+Canaro"">Read more on Last.fm</a>",43194,444150,Rodolfo Biagi,Osvaldo Fresedo,Alfredo De Angelis
Juan Carlos Caceres,tango,track,Toca Tango,2000,4B7iARS1wXjKFdNoIwlEe3,"See Juan Carlos Cáceres <a href=""https://www.last.fm/music/+noredirect/Juan+Carlos+Caceres"">Read more on Last.fm</a>",2914,12961,Tango Negro Trio,Conjunto Berretín,Carlos Di Sarli
Bruno Bertoli,tango,track,Tango De Amor,2000,4wZaejrFsd9ep90bS3iV8k," <a href=""https://www.last.fm/music/Bruno+Bertoli"">Read more on Last.fm</a>",3732,8220,Frankie Cimino,Umberto Scipione,Nadine e Marcus
Jesus Heredia,tango,track,Tangos. Sólo Cante por Jesús Heredia,2000,0pabpgJ56ziK1FcxihKLQe," <a href=""https://www.last.fm/music/Jesus+Heredia"">Read more on Last.fm</a>",310,806,Jose Galan,Placido Gonzalez,Jose De La Tomasa
Juana Amaya,tango,track,Tangos con Guitarra = 176,2000,2ExyCrCtRVz1KBzCSpaJIf," <a href=""https://www.last.fm/music/Juana+Amaya"">Read more on Last.fm</a>",419,3538,Jose Galvan,Manuel Salado,Adela Campallo
Juana Amaya,tango,track,Tangos con Guitarra = 160,2000,0ePO8WDhdAJWv2xvMGQp73," <a href=""https://www.last.fm/music/Juana+Amaya"">Read more on Last.fm</a>",419,3538,Jose Galvan,Manuel Salado,Adela Campallo
Al Caiola,tango,track,Tango Medley: Chitarra Romana (Roman Guitar) /Strada Del Bosce,2000,6zk2pxWz07WDPl2vFyeyU2,"Alexander Emil Caiola (September 7, 1920 – November 9, 2016), better known as Al Caiola, was a guitarist, composer and arranger who spanned a variety of music genres including jazz, country, rock, western, and pop. He recorded over fifty albums and worked with some of the biggest names in music during the 20th century, including Elvis Presley, Ferrante & Teicher, Frank Sinatra, Percy Faith, Buddy Holly, Mitch Miller, and Tony Bennett. During World <a href=""https://www.last.fm/music/Al+Caiola"">Read more on Last.fm</a>",53027,292910,Nelson Riddle,Billy Vaughn,Billy May
Enrique Montoya,tango,track,Tangos gitanos,2000,51Bz7YideNArNENP0b4zBR," <a href=""https://www.last.fm/music/Enrique+Montoya"">Read more on Last.fm</a>",1472,6744,Juanita Reina,Pepe Blanco,Pepe Pinto
Bertolt Brecht,tango,track,Tango-Ballad - The Threepenny Opera/1954 Original Broadway Cast/Remastered,2000,114uvPYLvf84W2r9tfGz1c,"Bertolt Brecht (born Eugen Berthold Friedrich Brecht; 10 February 1898–14 August 1956) was a German poet, playwright, and theatre director. His collaboration with composer Kurt Weill in particular created popular music classics such as Mack The Knife and Alabama Song. An influential theatre practitioner of the twentieth century, Brecht made equally significant contributions to dramaturgy and theatrical production, the latter particularly through <a href=""https://www.last.fm/music/Bertolt+Brecht"">Read more on Last.fm</a>",12202,91156,Lotte Lenya,Dagmar Krause,Klaus Kinski
Solo Compas,tango,track,tangos con guitarra 152 por minuto,2000,7mqTqDNLeEmj9D06Itwkex," <a href=""https://www.last.fm/music/Solo+Compas"">Read more on Last.fm</a>",1061,8095,Manuel Salado,Sevillanas,Chicuelo
Sólo Compás Flamenco,tango,track,Tangos con guitarra,2000,10bdu4Xqkg7LN8e37c0xzl," <a href=""https://www.last.fm/music/S%C3%B3lo+Comp%C3%A1s+Flamenco"">Read more on Last.fm</a>",339,2105,Manuel Salado,Jose Galvan,Juana Amaya
Francisco Tárrega,tango,track,Tango,2000,2B0GZptsB5AXXTnsbId5X2,"Francisco Tárrega (Francisto Tarrega y Eixea) (1852-11-21 - 1909-12-15) was a Spanish composer and guitarist. Born in Villarreal, Spain, he fell into an irrigation channel when he was young, which rendered him nearly blind. Partially due to this accident, the family moved to Castellon and enrolled him in music classes. Both his first music teachers, Eugeni Ruiz and Manuel Gonzalez, were blind. In 1862, guitarist Julián Arcas heard the young prodigy and encouraged him to journey to Barcelona, a hub for musicians. <a href=""https://www.last.fm/music/+noredirect/Francisco+T%C3%A1rrega"">Read more on Last.fm</a>",184454,1505445,Andrés Segovia,Joaquín Rodrigo,Isaac Albéniz
Pepa de Ricardo,tango,track,Tangos 2,2000,7DTxIfMlycIh0oJB2A3cqH,,,,,,
Sólo Compás Flamenco,tango,track,Tangos sin guitarra,2000,7pLe01mENAc4hTJJvAe4m3," <a href=""https://www.last.fm/music/S%C3%B3lo+Comp%C3%A1s+Flamenco"">Read more on Last.fm</a>",339,2105,Manuel Salado,Jose Galvan,Juana Amaya
Georges Moustaki,tango,track,Le tango de demain,2000,1X1i6WaDZeJQEAjJZpiIvq,"Georges Moustaki (1934-2013) was a singer-songwriter of Greek Jewish origin. Moustaki was born Yussef Mustacchi on the 3rd May 1934 in Alexandria, Egypt, of Sephardic Jewish parents who had moved there from Corfu, and who ran a bookshop in the city. The family spoke Italian at home, but Georges (then Yussef) spoke Arabic with his friends and attended a French school to which his Francophile parents sent him and his sisters. In 1951 he moved to Paris <a href=""https://www.last.fm/music/Georges+Moustaki"">Read more on Last.fm</a>",99578,884968,Serge Reggiani,Jean Ferrat,Maxime Le Forestier
Orquestra Romântica Brasileira,tango,track,Madreselva,2000,0XFXoKeljgaCIg1tHXPH88," <a href=""https://www.last.fm/music/+noredirect/Orquestra+Rom%C3%A2ntica+Brasileira"">Read more on Last.fm</a>",996,12110,Kike Fernández,Miguel Nacel,Orquesta Raiz Latina
Orquestra Romântica Brasileira,tango,track,Adios Muchachos,2000,0fJdQH9oeZsXCmv2eZoz1t," <a href=""https://www.last.fm/music/+noredirect/Orquestra+Rom%C3%A2ntica+Brasileira"">Read more on Last.fm</a>",996,12110,Kike Fernández,Miguel Nacel,Orquesta Raiz Latina
Roberto Goyeneche,tango,track,Balada para un Loco,2000,4n35TddfNkMH1UnvfCgTkv,"Roberto Goyeneche (1926 - 1994) was an Argentine tango singer who epitomized the archetype of 1950s Buenos Aires' bohemian life, and became a living legend in the local music scene. It was in 1944, at the age of 18, when the talented troubadour joined Raúl Kaplún's orchestra after winning a local contest, soon, debuting live in a local radio station called Belgrano. In 1952, Goyeneche teamed up with Horacio Salgán and with Aníbal Troilo in 1956 <a href=""https://www.last.fm/music/Roberto+Goyeneche"">Read more on Last.fm</a>",58732,561244,Julio Sosa,Carlos Gardel,Cacho Castaña
The Shadows,tango,track,Guitar Tango,2000,3TcpEbwdXAacOGW2C19xhw,"There is more than one act that goes by the name 'The Shadows'; 1) The Shadows (originally known as the Drifters) were an English instrumental rock group, who dominated the British popular music charts in the late 1950s and early 1960s, in the pre-Beatles era. They served as the backing band for Cliff Richard from 1958 to 1968, and have joined him for several reunion tours. The Shadows have had 69 UK chart singles from the 1950s to the 2000s, 35 credited to the Shadows and 34 to Cliff Richard and the Shadows. <a href=""https://www.last.fm/music/The+Shadows"">Read more on Last.fm</a>",383368,4015948,The Ventures,Cliff Richard,The Searchers
Djordje Balasevic,tango,track,Balkanski tango,2000,3Sz3Jx4XqKRCGKOYUeeBgT,"This is an incorrect tag for Đorđe Balašević. <a href=""https://www.last.fm/music/+noredirect/Djordje+Balasevic"">Read more on Last.fm</a>",11354,529325,Bijelo Dugme,Zabranjeno Pušenje,Crvena Jabuka
Andrés Calamaro,tango,track,Barrio de tango,2000,5Ku5SbsLdv4mlhLwhPG9jW,"Andres Calamaro is one of the most popular Argentinian pop-rock songwriters. A songs craftsman, as he likes to consider himself. Born Aug 22, 1961 in Buenos Aires, Argentina, he began his professional musical career at the age of 17 playing keyboards in Raíces. In 1981 he incorporated to one of the main bands of the Argentinean '80s rock scene: Los Abuelos de la Nada. Although the band was led by the brilliant Miguel Abuelo, Calamaro composed most of the band's hits <a href=""https://www.last.fm/music/+noredirect/Andr%C3%A9s+Calamaro"">Read more on Last.fm</a>",418596,14862363,Los Rodríguez,Fito Páez,Intoxicados
Tango Enrosque,tango,track,Desde al alma,2000,3fW8C6xWqV7QxwcS2sulCH," <a href=""https://www.last.fm/music/Tango+Enrosque"">Read more on Last.fm</a>",213,698,Trio Pantango,Trio Hugo Diaz,Tango Siempre
Cuarteto Guardia Vieja,tango,track,Desde el alma,2000,0ISLz5a4olabgrCTAZyTwE," <a href=""https://www.last.fm/music/Cuarteto+Guardia+Vieja"">Read more on Last.fm</a>",998,3864,Orquesta Tipica Victor,Francisco Canaro,Agustín Magaldi
Familia Montoya,tango,track,Montoya,2000,1QEnSYjVGlOXRoeDI05T0Q," <a href=""https://www.last.fm/music/Familia+Montoya"">Read more on Last.fm</a>",94,533,El Agujetas,Fernanda de Utrera,Ramón El Portugués
Niña Pastori,tango,track,Manolillo el Canastero (Tangos),2000,6IzadHg0LYaaEt5c6Uv9tN,"Niña Pastori is a Spanish flamenco singer (cantaora). She was born María Rosa García García in San Fernando (Cádiz) on 15 January 1978. The youngest of five siblings and only daughter of a military man (José) and gypsy flamenco singer La Pastori, she started her artistic career at a very young age. By the time she was six, she was accompanying her mother to the flamenco tablaos of her neighborhood, ""el Boquete"". A year later she won a contest in San Fernando <a href=""https://www.last.fm/music/+noredirect/Ni%C3%B1a+Pastori"">Read more on Last.fm</a>",130892,1024873,El Barrio,Ketama,Rosario
