artista,genero,tipo,nombre,año_lanzamiento,id,bio,oyentes,reproducciones,similar_1,similar_2,similar_3
Sir Elwoodin hiljaiset värit,tango,track,Tango - 2001 Remaster,2001,3fQqKab3twvhWCDpHiS7ZK,"Sir Elwoodin hiljaiset värit is a Finnish rock band, hailing from the Helsinki suburb of Kannelmäki. The band formed in 1988 when Juha Lehti and Juha Saaresaho got acquainted while working at the Myyrmäki Youth Centre. Including Pete Loikala, they recorded their first demo tapes. Despite publishing records and touring regularly they did not get a major success until they released the single ""Viimeisellä rannalla"" in 1993. They scored their biggest success in 1998 with the compilation ""Varjoja <a href=""https://www.last.fm/music/+noredirect/Sir+Elwoodin+Hiljaiset+V%C3%A4rit"">Read more on Last.fm</a>",29110,788215,Pauli Hanhiniemen Perunateatteri,Aknestik,Juliet Jonesin Sydän
Roland Dyens,tango,track,Tango en skai: Trois Pièces polyglottes,2001,14hhj39cO62G9w8yF5gab2,"Roland Dyens (October 19, 1955 – October 29, 2016) was a French classical guitarist, composer, and arranger. Dyens was born in Tunis, Tunisia. He studied guitar with the Spanish classical guitarist Alberto Ponce and analysis with Désiré Dondeyne. He has won several prizes in competitions for classical guitar performance as well as for composition. As a performer, Dyens is known for his extraordinary capacity for improvisation. Essentially unique among classical guitarists <a href=""https://www.last.fm/music/Roland+Dyens"">Read more on Last.fm</a>",41488,280788,Leo Brouwer,Antonio Lauro,Victor Villadangos
Film School,tango,track,Tangoed Out,2001,35J74bI4ZoGoNCOIhZPzt1,"FILM SCHOOL began life as a group of like-minded San Francisco musicians writing and producing music by themselves for themselves. The result was something very special indeed. Undoubtedly they rock - hungry unrestrained guitars and loud driven drumbeats - but it is a sound as brooding, atmospheric and self-contained as it is explosive and infectious. The band was among the first acts of a renewed wave of shoegazing music, harkening back to the late-1980s and early 1990s heyday of that genre. <a href=""https://www.last.fm/music/Film+School"">Read more on Last.fm</a>",164016,2366491,Flyying Colours,The Meeting Places,The Daysleepers
Sergio & Odair Assad,tango,track,Tango Suite: 3. Allegro,2001,5K2a0TB4O3RYOBxa2lHSAP,"(This is a misspelling of Sérgio & Odair Assad. Please fix your music tags.) Several times awarded and acknowledged as the best classic guitar duo in the world, the Duo Assad was formed by the brothers Sérgio Simão Assad and Odair Simão Assad at a very early age. Beginning to play the violão (acoustic guitar) at exactly the same time, they always studied with the same teachers and learned the same music and techniques and their exceptional functioning together derives of their profound understanding of each other <a href=""https://www.last.fm/music/+noredirect/Sergio+&+Odair+Assad"">Read more on Last.fm</a>",6595,46715,Sergio Assad,Marco Pereira,Paulo Bellinati
Jose Galvan,tango,track,Tangos de Malaga sin Baile Flamenco,2001,42yefKqKtOhFsPKBW1XeXR," <a href=""https://www.last.fm/music/Jose+Galvan"">Read more on Last.fm</a>",686,5537,Miguel Poveda,Chano Lobato,Carmen Linares
Eric Gemsa,tango,track,Tango Del Paris,2001,6wsd1YDKAIqGBZ3ugXXvoT," <a href=""https://www.last.fm/music/Eric+Gemsa"">Read more on Last.fm</a>",5876,29522,Christian Sebasto Toucas,Arcangela Wertmuller & Italo Greco,Philippe Lhommet & Jacques Mercier
Heiko Laux,tango,track,Tangoamt,2001,62XFjdN6xm30u6huWc5IFS,"Musician, DJ, Producer, and founder of techno label Kanzleramt. <a href=""https://www.last.fm/music/Heiko+Laux"">Read more on Last.fm</a>",51476,272631,Richard Harvey,Alexander Kowalski,Richie Hawtin
Eric Gemsa,tango,track,Tango Parigot,2001,5FcPZOLIqeO24mNsYaE1fV," <a href=""https://www.last.fm/music/Eric+Gemsa"">Read more on Last.fm</a>",5876,29522,Christian Sebasto Toucas,Arcangela Wertmuller & Italo Greco,Philippe Lhommet & Jacques Mercier
Jose Galvan,tango,track,Tangos con Baile Flamenco,2001,05T66gPT4LKlkuJUyipI8h," <a href=""https://www.last.fm/music/Jose+Galvan"">Read more on Last.fm</a>",686,5537,Miguel Poveda,Chano Lobato,Carmen Linares
Cri-Cri,tango,track,Tango Medroso,2001,0AQmffUsNdS93Epg43eGhE,"Cri-Cri is a fictional character, an anthropomorphic cricket, created by Francisco Gabilondo Soler in 1934 while broadcasting his own musical radio show on Mexico's station XEW. Cri-Cri is known as the ""grillito cantor"" or ""the singing cricket"". He is a character created by Francisco Gabilondo Soler in his childhood and may even be considered ""his inner personality"" The character became so famous and gave its author such renown, that it became a second name for Gabilondo. <a href=""https://www.last.fm/music/Cri-Cri"">Read more on Last.fm</a>",20428,321339,Los Hermanos Rincon,Cri Cri,Tlen Huicani
Corsario,tango,track,Tangos Soltos,2001,1Jx0wZbR7tKoZF1BYYsEJl,"Guatemalan rock band formed by Juan Fernando Herrera. Originally consisting of Herrera on vocals and lead guitar, Mario Aguiluz on Rhythm guitar, and Joseph Sibony on drums. in 2004, I Maria Calderon was added to the lineup on vocals. Aguiluz left the band in late 2004, and Joseph Sibony and Maria Calderon left the band in 2005. Since then, Herrera has resumed recording under the name corsario. He plays all instruments on his songs, and shares song-writing duties with his Brother, Carlos. <a href=""https://www.last.fm/music/Corsario"">Read more on Last.fm</a>",161,732,Nhemesis,ESPECIES,Estacion Gitana
Kurt Weill,tango,track,Tango-Ballade (with Max Raabe),2001,0UY9ysKwlNd1deSbT1vzO3,"Kurt Julian Weill (March 2, 1900 – April 3, 1950), born in Dessau, Germany and died in New York City, was a composer active from the 1920s until his death. He was a leading composer for the stage, as well as writing a number of concert works. Over fifty years after his death, his music continues to be performed both in popular and classical contexts. In Weill's lifetime, his work was most associated with the voice of his wife, Lotte Lenya, but <a href=""https://www.last.fm/music/Kurt+Weill"">Read more on Last.fm</a>",69341,598895,Charles Ives,Igor Stravinsky,Arnold Schönberg
Angela Similea,tango,track,Tangoul,2001,2tO9N1fhMJRHEfIf7gWrPa,"Motto: Disciplina, Daruire, Adevar S-a nascut la 9 iulie 1946, la fosta Ferma Regala, astazi localitatea 1 Decembrie. Initial solista a corului scolar, urmeaza cursurile eminentei profesoare de canto, Florica Orascu, timp de 10 ani, fiind absolventa a Scolii de Arta. La cursurile de perfectionare a luat lectii cu regizorii Nicolae Frunzetti si Sanda Manu. 1965: Incepe sa cante in miscarea de amatori, afirmandu-se in cadrul Festivalului artistilor amatori, unde obtine premiul al lll lea cu melodia ”Campia sub luna” de V. Veselovski. <a href=""https://www.last.fm/music/Angela+Similea"">Read more on Last.fm</a>",2507,27073,Mirabela DAUER,Mihaela Runceanu,Corina Chiriac
Expresso 86,tango,track,Tango É Este Meu Jeito,2001,4Hq8AjCFqhJzK3MpxIjaNm," <a href=""https://www.last.fm/music/Expresso+86"">Read more on Last.fm</a>",134,732,Agrupamento Musical Diapasão,Paulo Ribeiro,Bandalusa
Manuel Soto,tango,track,Las fatigas del querer - Tangos,2001,5CXoo2Z2NgeCNLoybBUFM5," <a href=""https://www.last.fm/music/Manuel+Soto"">Read more on Last.fm</a>",60,138,La Paquera de Jerez,La Perla De Cádiz,Fernanda de Utrera
Chato De La Isla,tango,track,A pasar penitas dobles - Tangos,2001,1PLyNDPovtIbM8fC2koFpa," <a href=""https://www.last.fm/music/Chato+De+La+Isla"">Read more on Last.fm</a>",607,1987,Porrinas De Badajoz,Terremoto de Jerez,Paquera Jerez
Chiquetete,tango,track,Las Estrellitas De Plata (Tangos),2001,4OepQLQXwSkKkcKpeqYvx8,"Chiquetete (Antonio José Cortés Pantoja, Algeciras, Spain, 26 July 1948 - 16 December 2018) was a Spanish flamenco singer. <a href=""https://www.last.fm/music/Chiquetete"">Read more on Last.fm</a>",22454,145144,Los Chunguitos,Los Chichos,Manzanita
Florindo Sassone Y Su Gran Orq. Tipica,tango,track,A La Gran Muñeca,2001,0AUMxWsbm5sTU7bV2cbQJp," <a href=""https://www.last.fm/music/Florindo+Sassone+Y+Su+Gran+Orq.+Tipica"">Read more on Last.fm</a>",1129,4417,Atilio Stampone Y Orquesta,Orquesta Típica Tangarte,Hector Varela
Orquesta Color Tango,tango,track,Ilusion De Mi Vida,2001,41laVFcybi2zFDdZFkUUwu," <a href=""https://www.last.fm/music/Orquesta+Color+Tango"">Read more on Last.fm</a>",777,10055,Carlos Di Sarli,Color Tango,Alfredo De Angelis
Niño de las Marianas,tango,track,Madrecita de Mi Alma: Marianas-Tangos,2001,0XvRlNcp2BW9vZN20B6TEp," <a href=""https://www.last.fm/music/+noredirect/Ni%C3%B1o+de+las+Marianas"">Read more on Last.fm</a>",50,153,José Menese,Santiago Donday,Pericón de Cádiz
Porrina de Badajoz,tango,track,Cojo la Vara y Mi Carro - Tangos,2001,0oOAterEIz2GWejRDp1Rw3," <a href=""https://www.last.fm/music/Porrina+de+Badajoz"">Read more on Last.fm</a>",2592,15618,Juanito Varea,Pepe Marchena,Antonio Chacón
Osvaldo Pugliese,tango,track,Desde El Alma - Instrumental,2001,7Gp9FgNeO4E8jfW9142I7T,"Osvaldo Pedro Pugliese (December 2, 1905 - July 25, 1995) was an Argentine tango musician. He developed dramatic arrangements that retained strong elements of the walking beat of salon tango but also heralded the development of concert-style tango music. Some of his music is used for theatrical dance performances. In Buenos Aires, Pugliese is often played later in the evening when the dancers want to dance more slowly, impressionistically and intimately. <a href=""https://www.last.fm/music/Osvaldo+Pugliese"">Read more on Last.fm</a>",57388,534954,Juan D'Arienzo,Carlos Gardel,Julio Sosa
Florindo Sassone Y Su Gran Orq. Tipica,tango,track,Derecho Viejo,2001,6Mdsxyy1NbPIFXD3Bb7O2w," <a href=""https://www.last.fm/music/Florindo+Sassone+Y+Su+Gran+Orq.+Tipica"">Read more on Last.fm</a>",1129,4417,Atilio Stampone Y Orquesta,Orquesta Típica Tangarte,Hector Varela
José Parra,tango,track,Candela (Tangos),2001,4lolZNuzg2HLcamjw10vsB," <a href=""https://www.last.fm/music/+noredirect/Jos%C3%A9+Parra"">Read more on Last.fm</a>",751,2681,Pansequito,Vicente Soto Sordera,Sonia Miranda
Orquesta Color Tango,tango,track,Gallo Ciego,2001,10GwJIMnc8kaiWOzGNFXYD," <a href=""https://www.last.fm/music/Orquesta+Color+Tango"">Read more on Last.fm</a>",777,10055,Carlos Di Sarli,Color Tango,Alfredo De Angelis
Niño de las Marianas,tango,track,Por Dios No Pegadle Más Palitos: Marianas-Tangos,2001,7mj8jeyK9vmx42bNgFkKrQ," <a href=""https://www.last.fm/music/+noredirect/Ni%C3%B1o+de+las+Marianas"">Read more on Last.fm</a>",50,153,José Menese,Santiago Donday,Pericón de Cádiz
Alberto Castillo,tango,track,Cucusita,2001,6LyuP3uEWwBrF2vOlejxTr,"Alberto Castillo (December 7, 1914 - July 23, 2002) True name: Alberto Salvador De Lucca The very peculiar style of Alberto Castillo maybe has something to do with the mocking (humorous) grace of outskirts origin of Rosita Quiroga, Sofía Bozán or Tita Merello. But in no way these are influences; neither have they similarity among them nor Castillo resembles them. Simply, we could group them –and add them to the subsequent Elba Berón- because they are united by a common air, the same unpolished cadence. <a href=""https://www.last.fm/music/Alberto+Castillo"">Read more on Last.fm</a>",20984,121244,Alfredo De Angelis,Pedro Laurenz,Roberto Firpo
Florindo Sassone Y Su Gran Orq. Tipica,tango,track,Bahia Blanca,2001,33ZD0KJcDm3nJoD92mtDKL," <a href=""https://www.last.fm/music/Florindo+Sassone+Y+Su+Gran+Orq.+Tipica"">Read more on Last.fm</a>",1129,4417,Atilio Stampone Y Orquesta,Orquesta Típica Tangarte,Hector Varela
Jose Basso,tango,track,Triunfal,2001,5IzdvfX4TPwJ8qTmUKkaaa,"Pianist, leader and composer Complete name: José Hipólito Basso (30 January 1919 - 14 August 1993) José Basso played in Aníbal ""Pichuco"" Troilo's famous tango orchestra until 1947, and during that time he was at 88 recordings, the last of them was a record that on one side was ""Flor de lino"", sung by Floreal Ruiz and on the other side, ""El milagro"", with Edmundo Rivero's voice, on April 29, 1947. Because of having had Troilo as leader for so long time <a href=""https://www.last.fm/music/+noredirect/Jose+Basso"">Read more on Last.fm</a>",507,2997,Raúl Garello,Alberto Podesta,Alberto Marino
Osvaldo Pugliese,tango,track,Gallo Ciego - Instrumental,2001,2mL6Fa3uziIZmRGjQl7u4e,"Osvaldo Pedro Pugliese (December 2, 1905 - July 25, 1995) was an Argentine tango musician. He developed dramatic arrangements that retained strong elements of the walking beat of salon tango but also heralded the development of concert-style tango music. Some of his music is used for theatrical dance performances. In Buenos Aires, Pugliese is often played later in the evening when the dancers want to dance more slowly, impressionistically and intimately. <a href=""https://www.last.fm/music/Osvaldo+Pugliese"">Read more on Last.fm</a>",57388,534954,Juan D'Arienzo,Carlos Gardel,Julio Sosa
Niño Josele,tango,track,Rastro Viejo (Tangos),2001,1yWzmn2gWMS0YaA2QFn1wY,"Niño Josele es un obrero de la guitarra flamenca con un pie puesto en la música clásica contemporánea y otro donde surja. Si hay que colaborar con Lenny Kravitz, se colabora; si hay que hacerlo con Alicia Keys, pues también. El guitarrista almeriense bifurca su labor en dos vertientes. La principal, de momento, es el acompañamiento al cante, ya sea al lado de Diego el Cigala o junto a veteranos como Enrique Morente o Pepe de Lucía, un cariz de su toque que fundamenta en el diálogo. <a href=""https://www.last.fm/music/+noredirect/Ni%C3%B1o+Josele"">Read more on Last.fm</a>",19362,133364,Son De La Frontera,Gerardo Núñez,Duquende
Sebastián El Pena,tango,track,En el Balcón (Tango del Balcón),2001,03ABcrKwNqHlbUbGRevBBL," <a href=""https://www.last.fm/music/Sebasti%C3%A1n+El+Pena"">Read more on Last.fm</a>",58,233,Niño de Vélez,Juan Breva,Pepe de la Matrona
Enrique Morente,tango,track,A la hora de la muerte,2001,4JzWUbzawZzVVrDD5VrNZH,"Enrique Morente Cotelo (25 December 1942 – 13 December 2010), known as Enrique Morente, was a flamenco singer (in Spanish, cantaor) and a controversial figure within the world of contemporary flamenco. After his orthodox beginnings, he plunged into experimentalism, writing new melodies for cante (flamenco singing) and jamming with musicians of all styles, without renouncing his roots in traditional flamenco singing, which he kept on cultivating. <a href=""https://www.last.fm/music/Enrique+Morente"">Read more on Last.fm</a>",77129,776495,Camarón de la Isla,Estrella Morente,Lole Y Manuel
Manolo Caracol,tango,track,No Tengas Pena Dolores (Tangos),2001,6V5ktJfozBSeE23e7njZMh,"Manuel Ortega Juárez. (July 9, 1909 - February 24, 1973), was a flamenco cantaor (singer). Born in Seville, Spain, he was descended from a long line of flamenco artists including Enrique Ortega (father and son) and Curro Dulce, and he was possibly related to El Planeta and El Fillo. The family was also known for its bull fighters. Under the stage name El Caracol, he ""gained international fame as much for his flamboyant personality as for his extraordinary cante. <a href=""https://www.last.fm/music/Manolo+Caracol"">Read more on Last.fm</a>",21549,112679,Antonio Mairena,Chano Lobato,Carmen Linares
Osvaldo Pugliese,tango,track,Zum,2001,6F67zH8RoFhIL0RK5vH4Ze,"Osvaldo Pedro Pugliese (December 2, 1905 - July 25, 1995) was an Argentine tango musician. He developed dramatic arrangements that retained strong elements of the walking beat of salon tango but also heralded the development of concert-style tango music. Some of his music is used for theatrical dance performances. In Buenos Aires, Pugliese is often played later in the evening when the dancers want to dance more slowly, impressionistically and intimately. <a href=""https://www.last.fm/music/Osvaldo+Pugliese"">Read more on Last.fm</a>",57388,534954,Juan D'Arienzo,Carlos Gardel,Julio Sosa
Orquesta Color Tango,tango,track,Pata Ancha,2001,0gYcFV3mTBMs1BaZ32WXJl," <a href=""https://www.last.fm/music/Orquesta+Color+Tango"">Read more on Last.fm</a>",777,10055,Carlos Di Sarli,Color Tango,Alfredo De Angelis
Diego El Cigala,tango,track,"Ana, Dolores y Aurora (Tangos)",2001,3arjjXMSCdpdCJ7lqPAMIp,"Diego el Cigala, Latin-Grammy-winning Gypsy singer from Madrid is noted as a pioneer in fusing flamenco with Latin American music forms such as the bolero, Afro-Caribbean jazz, and tango. His ability to blend different types of contemporary music with traditional flamenco has won him widespread popularity and numerous awards. He is best known for his 2003 release Bebo y Cigala: ""Lágrimas Negras"" - with Cuban jazz pianist Bebo Valdés - which was hailed Album of the Year by the New York Times, and received a Latin Grammy. <a href=""https://www.last.fm/music/Diego+El+Cigala"">Read more on Last.fm</a>",74182,663242,Niña Pastori,Buika,Camarón de la Isla
Boris Kovac,tango,track,The Last Balkan Tango,2001,6WV6T7S9YspMaPMetZKfKM,"This is an incorrect page for Boris Kovač. Boris Kovač & Ladaaba Orchest is the correct tag for his band. If this non-artist appears in your charts, do Last.fm and yourself a favor. Fix your artist tags. <a href=""https://www.last.fm/music/Boris+Kovac"">Read more on Last.fm</a>",4124,39394,Boris Kovač & LaDaABa Orchest,Boris Kovac & La Campanella,Boris Kovač
Alberto Castillo,tango,track,Muñeca brava,2001,2SPb8awMSxa5NmSaBQKWGN,"Alberto Castillo (December 7, 1914 - July 23, 2002) True name: Alberto Salvador De Lucca The very peculiar style of Alberto Castillo maybe has something to do with the mocking (humorous) grace of outskirts origin of Rosita Quiroga, Sofía Bozán or Tita Merello. But in no way these are influences; neither have they similarity among them nor Castillo resembles them. Simply, we could group them –and add them to the subsequent Elba Berón- because they are united by a common air, the same unpolished cadence. <a href=""https://www.last.fm/music/Alberto+Castillo"">Read more on Last.fm</a>",20984,121244,Alfredo De Angelis,Pedro Laurenz,Roberto Firpo
Jose Merce,tango,track,Mira si yo a ti te quiero - Tangos,2001,5SXZK53JF7zR7S7sTZlg6m,"misspelt name for José Mercé See more at http://es.wikipedia.org/wiki/Jose_Merce. <a href=""https://www.last.fm/music/Jose+Merce"">Read more on Last.fm</a>",48282,299187,Duquende,Remedios Amaya,José Mercé
Jose Merce,tango,track,Pa' saber de tu querer - Tangos,2001,2RZEAiw4wmpe05j0fZd9nJ,"misspelt name for José Mercé See more at http://es.wikipedia.org/wiki/Jose_Merce. <a href=""https://www.last.fm/music/Jose+Merce"">Read more on Last.fm</a>",48282,299187,Duquende,Remedios Amaya,José Mercé
Jack The Ripper,tango,track,Prayer in a Tango - 2022 Remaster,2001,6x2QRM6z7sCLXyh1uX4Pmc,"1.Jack The Ripper forms part of these formations which skilfully knew to transcend their poisonous influences come straight of Nick Cave through melodies elegant, melancholic persons and tinted of a dark and slightly obsolete romanticism, that French would not have known to evoke with as much intensity. It is into 1995 that eight Parisian musicians decide to found the group Jack The Ripper. This Christian name is heavy direction, since it is also the name of the most famous British serial killer <a href=""https://www.last.fm/music/Jack+The+Ripper"">Read more on Last.fm</a>",21131,304566,Jil Is Lucky,Girls in Hawaii,Moriarty
Orquesta Color Tango,tango,track,Pavadita,2001,7gSRwothP0GWAjdTzUTixv," <a href=""https://www.last.fm/music/Orquesta+Color+Tango"">Read more on Last.fm</a>",777,10055,Carlos Di Sarli,Color Tango,Alfredo De Angelis
Ernesto Baffa,tango,track,Malena,2001,0NvNWyQKtMeGD0aqMaUi09,"Pianist, bandleader, composer and arranger (21 March 1935) Full name: Ernesto Guillermo Baffa ""Pichuco’s talkin’, kid!... I’m at the Marabú, come here ‘cause you’re gonna join my orchestra."" «I hurried up right away, -Ernesto recalls- and ten days later I was playing with Aníbal Troilo». That phone call he got at the house of his mother, doña Rosario, back in 1959, still gives him a thrill. Once El Gordo had mistaken him for Leopoldo Federico when Baffa played in the Horacio Salgán’s aggregation <a href=""https://www.last.fm/music/Ernesto+Baffa"">Read more on Last.fm</a>",3727,11843,Orquesta Típica Tangarte,Beba Pugliese,José Basso
Boris Kovac,tango,track,Begin for Julia,2001,4Y5QsPl6jUL60NxIDSMULo,"This is an incorrect page for Boris Kovač. Boris Kovač & Ladaaba Orchest is the correct tag for his band. If this non-artist appears in your charts, do Last.fm and yourself a favor. Fix your artist tags. <a href=""https://www.last.fm/music/Boris+Kovac"">Read more on Last.fm</a>",4124,39394,Boris Kovač & LaDaABa Orchest,Boris Kovac & La Campanella,Boris Kovač
Sexteto Tango,tango,track,La Bordona,2001,6uDSxFECOxTfsI9a2rTOtE," <a href=""https://www.last.fm/music/Sexteto+Tango"">Read more on Last.fm</a>",7183,24830,Quinteto Pirincho,Quinteto Real,Manga De Tanos
José Parra,tango,track,Caramelo (Tangos),2001,5dZdUJYx3WssgjahEaumTT," <a href=""https://www.last.fm/music/+noredirect/Jos%C3%A9+Parra"">Read more on Last.fm</a>",751,2681,Pansequito,Vicente Soto Sordera,Sonia Miranda
Sexteto Tango,tango,track,Nochero Soy,2001,0VAR1F3XWxs3aXoSaMd9IJ," <a href=""https://www.last.fm/music/Sexteto+Tango"">Read more on Last.fm</a>",7183,24830,Quinteto Pirincho,Quinteto Real,Manga De Tanos
El Gran Kiki,tango,track,Tabernero (Tango del Borracho) - Remastered,2001,4rVxW6VboRUWbdh3aQ2NeT," <a href=""https://www.last.fm/music/El+Gran+Kiki"">Read more on Last.fm</a>",118,217,Los Xey,Rosita Ferrer,Estrellita de Palma
Juanjo Dominguez,tango,track,Los Ejes de Mi Carreta,2001,6bKtoBFn8NvPIkbRTNfTuz,"Juanjo Domínguez (October 23, 1951 – February 10, 2019) was an Argentine classical guitarist and important interpreter of Argentine music, especially tango. In 2005, he was awarded the Konex Award for best instrumental single artist of popular music. <a href=""https://www.last.fm/music/Juanjo+Dominguez"">Read more on Last.fm</a>",4477,43208,Juanjo Dominguez & Julio Pane,Cacho Tirao,Color Tango
Quinteto Pirincho,tango,track,El Entrerriano,2001,7InwD6zDHSKamMW2WGifPF,"https://tango.info/wiki/Quinteto_Pirincho <a href=""https://www.last.fm/music/Quinteto+Pirincho"">Read more on Last.fm</a>",11263,49458,Roberto Firpo,Julio De Caro,Lucio Demare
Osvaldo Pugliese,tango,track,La Rayuela - Instrumental,2001,1k0fGX3smslY2oEL6xbdz3,"Osvaldo Pedro Pugliese (December 2, 1905 - July 25, 1995) was an Argentine tango musician. He developed dramatic arrangements that retained strong elements of the walking beat of salon tango but also heralded the development of concert-style tango music. Some of his music is used for theatrical dance performances. In Buenos Aires, Pugliese is often played later in the evening when the dancers want to dance more slowly, impressionistically and intimately. <a href=""https://www.last.fm/music/Osvaldo+Pugliese"">Read more on Last.fm</a>",57388,534954,Juan D'Arienzo,Carlos Gardel,Julio Sosa
Osvaldo Pugliese,tango,track,Yunta De Oro - Instrumental,2001,7GyJ1UKIq40qcGK5ahZSf8,"Osvaldo Pedro Pugliese (December 2, 1905 - July 25, 1995) was an Argentine tango musician. He developed dramatic arrangements that retained strong elements of the walking beat of salon tango but also heralded the development of concert-style tango music. Some of his music is used for theatrical dance performances. In Buenos Aires, Pugliese is often played later in the evening when the dancers want to dance more slowly, impressionistically and intimately. <a href=""https://www.last.fm/music/Osvaldo+Pugliese"">Read more on Last.fm</a>",57388,534954,Juan D'Arienzo,Carlos Gardel,Julio Sosa
Georg Danzer,tango,track,Strandbrunzer-Tango - Re-Mastered 2011,2001,5cY4gfwlQkJ6G2tXb9spZn,"Georg Danzer (October 7, 1946 - June 21, 2007) was an Austrian singer-songwriter, most famous for his songs ""Jö Schau"", ""Weisse Pferde"" and ""Hupf' in Gatsch"". He was a pioneer for the music genre ""Austropop"" starting in the 1960's and became a part of the ""Austrian Supergroup"" ""Austria 3"" in the 1990's (featuring Wolfgang Ambros and Rainhard Fendrich). On june 21st 2007 he lost his fighting against lung cancer which was declared a year earlier. <a href=""https://www.last.fm/music/Georg+Danzer"">Read more on Last.fm</a>",38560,518125,Wolfgang Ambros,Peter Cornelius,STS
Osvaldo Pugliese,tango,track,9 De Julio - Instrumental,2001,60qc3hbpTwlirf7SoNa7By,"Osvaldo Pedro Pugliese (December 2, 1905 - July 25, 1995) was an Argentine tango musician. He developed dramatic arrangements that retained strong elements of the walking beat of salon tango but also heralded the development of concert-style tango music. Some of his music is used for theatrical dance performances. In Buenos Aires, Pugliese is often played later in the evening when the dancers want to dance more slowly, impressionistically and intimately. <a href=""https://www.last.fm/music/Osvaldo+Pugliese"">Read more on Last.fm</a>",57388,534954,Juan D'Arienzo,Carlos Gardel,Julio Sosa
Orquesta Color Tango,tango,track,A Evaristo Carriego,2001,6EveelMwvn8xh3OE0xvSA9," <a href=""https://www.last.fm/music/Orquesta+Color+Tango"">Read more on Last.fm</a>",777,10055,Carlos Di Sarli,Color Tango,Alfredo De Angelis
Gabriel Moreno,tango,track,De color de cera,2001,40n8FwhaKjsdJMsoiacKIF,"Gabriel Moreno (José Gabriel Moreno Carrillo, Linares, Jaén, Spain, 12 April 1941 - 10 March 2019) was a Spanish gypsy flamenco singer (cantaor). <a href=""https://www.last.fm/music/Gabriel+Moreno"">Read more on Last.fm</a>",4595,15045,Pepe de la Matrona,Antonio Mairena,El Indio Gitano
