artista,genero,tipo,nombre,año_lanzamiento,id,bio,oyentes,reproducciones,similar_1,similar_2,similar_3
Cuarteto Guardia Vieja,tango,track,El entrerriano,2000,42IqJC1LOiLTDRmiOz0cCI," <a href=""https://www.last.fm/music/Cuarteto+Guardia+Vieja"">Read more on Last.fm</a>",998,3864,Orquesta Tipica Victor,Francisco Canaro,Agustín Magaldi
Orquesta Cuerdas Latinas,tango,track,Nostalgia,2000,5JbDJxg9aJTHHxsJTh21q0," <a href=""https://www.last.fm/music/Orquesta+Cuerdas+Latinas"">Read more on Last.fm</a>",633,2184,Aldo Livorno y su acordeón Napolitano,Cuerdas Y Metales,Orquesta Cuerdas Y Metales
Juan D'Arienzo,tango,track,La cumparsita,2000,6SDcXziDDroaS7jPdpGfiI,"Juan D'Arienzo (December 14, 1900-January 14, 1976) was an Argentine tango musician, also known as ""El Rey del Compas"" (King of the Beat). Departing from other orchestras of the golden age, D'Arienzo returned to the 2x4 feel that characterized music of the old guard, but he used more modern arrangements and instrumentation. His popular group produced hundreds of recordings. His music is played often at milongas in Buenos Aires, and the instrumentals are the classic harder rhythmic tangos with a strong staccato dance rhythm. <a href=""https://www.last.fm/music/Juan+D%27Arienzo"">Read more on Last.fm</a>",43870,453325,Osvaldo Pugliese,Carlos Gardel,Julio Sosa
Ariel Ramírez,tango,track,Felicia,2000,0T6I8h5l4fUFFt8lFOLPpl,"Ariel Ramírez (4 September 1921 – 18 February 2010) was an Argentine composer, pianist and music director. He was considered ""a chief exponent of Argentine folk music"" and noted for his ""iconic"" musical compositions. Ramírez is known primarily for his Misa Criolla (1964). It allowed him to travel around Europe and Latin America to build his reputation. He had more than 300 compositions during his career and sold millions of albums. By the time he died in 2010, his work was globally renowned. <a href=""https://www.last.fm/music/+noredirect/Ariel+Ram%C3%ADrez"">Read more on Last.fm</a>",13224,118440,Los Chalchaleros,Eduardo Falú,Los Fronterizos
Nicolás Colacho Brizuela,tango,track,Ojos Negros,2000,4oaz8jvfPTHkQ721sA30GC," <a href=""https://www.last.fm/music/Nicol%C3%A1s+Colacho+Brizuela"">Read more on Last.fm</a>",106,739,Rodolfo Mederos,Aníbal Arias,Carlos Moscardini
Orquesta Cuerdas Latinas,tango,track,Sentimiento Gaucho,2000,43EMpDKJclXPldUKGB0E1d," <a href=""https://www.last.fm/music/Orquesta+Cuerdas+Latinas"">Read more on Last.fm</a>",633,2184,Aldo Livorno y su acordeón Napolitano,Cuerdas Y Metales,Orquesta Cuerdas Y Metales
Nicolás Colacho Brizuela,tango,track,Flor de Lino,2000,25MvykgQ99Tq5AKepDfANy," <a href=""https://www.last.fm/music/Nicol%C3%A1s+Colacho+Brizuela"">Read more on Last.fm</a>",106,739,Rodolfo Mederos,Aníbal Arias,Carlos Moscardini
Carlos Di Sarli,tango,track,A la gran muneca,2000,2yxqWuu05LPz9Lagkg6C9l,"Carlos Di Sarli (January 7, 1903 - January 12, 1960) was an Argentine tango musician, orchestra leader, composer and pianist. Before starting his own tango orchestra, he played in Osvaldo Fresedo's orchestra. He developed smooth, clean-sounding, powerful arrangements which his Orquesta típica and recorded 27 albums and 512 recordings are reported. His music is widely used by learner dancers because of its easy, danceable sound, and is played regularly in milongas for social tango dancing. <a href=""https://www.last.fm/music/Carlos+Di+Sarli"">Read more on Last.fm</a>",24950,403703,Francisco Canaro,Rodolfo Biagi,Miguel Caló
Orquesta Cuerdas Latinas,tango,track,El Día Que Me Quieras,2000,4DZze2hX4UELqCbFt1bxdX," <a href=""https://www.last.fm/music/Orquesta+Cuerdas+Latinas"">Read more on Last.fm</a>",633,2184,Aldo Livorno y su acordeón Napolitano,Cuerdas Y Metales,Orquesta Cuerdas Y Metales
Ariel Ramírez,tango,track,Germaine,2000,0KWfrbi8vcR6TrbRNXVqpn,"Ariel Ramírez (4 September 1921 – 18 February 2010) was an Argentine composer, pianist and music director. He was considered ""a chief exponent of Argentine folk music"" and noted for his ""iconic"" musical compositions. Ramírez is known primarily for his Misa Criolla (1964). It allowed him to travel around Europe and Latin America to build his reputation. He had more than 300 compositions during his career and sold millions of albums. By the time he died in 2010, his work was globally renowned. <a href=""https://www.last.fm/music/+noredirect/Ariel+Ram%C3%ADrez"">Read more on Last.fm</a>",13224,118440,Los Chalchaleros,Eduardo Falú,Los Fronterizos
Roberto Goyeneche,tango,track,Barrio de Tango,2000,0Iul5F0oi2eA5TbPCbXS3U,"Roberto Goyeneche (1926 - 1994) was an Argentine tango singer who epitomized the archetype of 1950s Buenos Aires' bohemian life, and became a living legend in the local music scene. It was in 1944, at the age of 18, when the talented troubadour joined Raúl Kaplún's orchestra after winning a local contest, soon, debuting live in a local radio station called Belgrano. In 1952, Goyeneche teamed up with Horacio Salgán and with Aníbal Troilo in 1956 <a href=""https://www.last.fm/music/Roberto+Goyeneche"">Read more on Last.fm</a>",58732,561244,Julio Sosa,Carlos Gardel,Cacho Castaña
Roberto Goyeneche,tango,track,Barrio de Tango,2000,6stTJHvWwpeWvCubT8a50q,"Roberto Goyeneche (1926 - 1994) was an Argentine tango singer who epitomized the archetype of 1950s Buenos Aires' bohemian life, and became a living legend in the local music scene. It was in 1944, at the age of 18, when the talented troubadour joined Raúl Kaplún's orchestra after winning a local contest, soon, debuting live in a local radio station called Belgrano. In 1952, Goyeneche teamed up with Horacio Salgán and with Aníbal Troilo in 1956 <a href=""https://www.last.fm/music/Roberto+Goyeneche"">Read more on Last.fm</a>",58732,561244,Julio Sosa,Carlos Gardel,Cacho Castaña
Tita Merello,tango,track,Con El Tango En El Alma,2000,23V4f4vBQ6CqMN7kkHFCGX,"Tita Merello was born in 1904 in Buenos Aires. She was a prominent film actress and tango dancer and singer. She made almost 45 appearances in film between 1933 and 1985 spanning 6 decades of Argentine cinema. She entered film in 1933 in Tango and appeared in films such as Arrabalera in 1950, working with acclaimed actors such as Santiago Gómez Cou and Tito Alonso. She retired from film in 1985 and died on Christmas Eve 2002 aged 98. <a href=""https://www.last.fm/music/Tita+Merello"">Read more on Last.fm</a>",18059,124219,Edmundo Rivero,Nelly Omar,Hugo Del Carril
Sidy Bonco Tangoudia,tango,track,Douna,2000,2rFoyB3CsiNFLSJ0msnT0L," <a href=""https://www.last.fm/music/Sidy+Bonco+Tangoudia"">Read more on Last.fm</a>",5,11,,,
Héctor Ulises Passarella,tango,track,Libertango - orchestrated by Luis Enriques Bacalov,2000,0SZdwxuTuQgv2wGEH3gqFq," <a href=""https://www.last.fm/music/H%C3%A9ctor+Ulises+Passarella"">Read more on Last.fm</a>",131,498,Astor Piazzolla,Quadro Nuevo,Tango Siempre
Nacha Guevara,tango,track,El día que me quieras,2000,4q75EDSAd7jvObhSAQdrk2,"Nacha Guevara is one of the more prolific, versatile, charismatic, influential, and loved artists. Back in the 70's she performed in New York and shortly after that became well known among the folkloric genre in Mexico and the rest of the Americas. Originally a dancer converted to actress and ultimately learned to sing she rose to become a strong pillar in the latin-american music . One of the most known and remembered songs in U. S. is that one that recites ""Don't cry for me Argentina"". <a href=""https://www.last.fm/music/Nacha+Guevara"">Read more on Last.fm</a>",6695,56143,Liliana Herrero,Silvia Iriondo,Alberto Rojo
Carlos Gardel,tango,track,Volver,2000,4s44xSFqLeEr9PMolrFWAt,"Carlos Gardel (born Charles Romuald Gardes; 11 December 1890 – 24 June 1935) was an Argentine tango singer, songwriter, composer and actor, and is perhaps the most prominent figure in the history of tango. Gardel died in an airplane crash at the height of his career, becoming an archetypal tragic hero mourned throughout Latin America. For many, Gardel embodies the soul of the tango style. He is commonly referred to as ""Carlitos"", ""El Zorzal"" (The Song Thrush) <a href=""https://www.last.fm/music/Carlos+Gardel"">Read more on Last.fm</a>",230365,2489554,Roberto Goyeneche,Julio Sosa,Juan D'Arienzo
Nacha Guevara,tango,track,Nostalgia,2000,2LRtAufTRXz5VRPDUixwFI,"Nacha Guevara is one of the more prolific, versatile, charismatic, influential, and loved artists. Back in the 70's she performed in New York and shortly after that became well known among the folkloric genre in Mexico and the rest of the Americas. Originally a dancer converted to actress and ultimately learned to sing she rose to become a strong pillar in the latin-american music . One of the most known and remembered songs in U. S. is that one that recites ""Don't cry for me Argentina"". <a href=""https://www.last.fm/music/Nacha+Guevara"">Read more on Last.fm</a>",6695,56143,Liliana Herrero,Silvia Iriondo,Alberto Rojo
El Cuchara y su Familia,tango,track,Cántame por Tangos,2000,1DV613Ql4eYsvdspQKdVkw," <a href=""https://www.last.fm/music/El+Cuchara+y+su+familia"">Read more on Last.fm</a>",6,37,,,
Ingrid Caven,tango,track,Trans Europe Tango,2000,4BBCkqWKNfdh67Q2pneTvK,"Ingrid Caven (born 3 August 1938) is a German film actress and singer. Caven has appeared in over 50 films since her film debut in 1969 in the short film Fernes Jamaica followed by her first featured film Liebe ist kälter als der Tod (Love Is Colder Than Death) directed by Rainer Werner Fassbinder, to whom she was briefly married (1970-72). Her career was at its peak in the 1970s and early 1980s mostly in film. 1981 was a particularly good year for Caven. <a href=""https://www.last.fm/music/Ingrid+Caven"">Read more on Last.fm</a>",2243,31521,Tim Fischer,Lotte Lenya,Damia
Tom Lehrer,tango,track,The Masochism Tango,2000,0DdTDvtTmtTzEHvwzQzA1I,"Thomas Andrew ""Tom"" Lehrer (born 9 April 1928) is an American singer-songwriter, satirist, pianist, and mathematician. He has lectured on mathematics and musical theater. Before attending college, Lehrer graduated from the Loomis Chaffee School in Windsor, Connecticut. As an undergraduate student at Harvard University, he began to write comic songs to entertain his friends, including Fight Fiercely, Harvard (1945). Those songs later became (in a joking reference to a leading scientific journal, The Physical Review) The Physical Revue. <a href=""https://www.last.fm/music/Tom+Lehrer"">Read more on Last.fm</a>",238197,3941084,"""Weird Al"" Yankovic",Lemon Demon,Jonathan Coulton
Willie And Lobo,tango,track,Olo Molina's Tango,2000,6S27ZgNU8H6RaUQpfksmuR,"Living on an island barefoot walking the beach swimming in shimmering turquoise clear waters gazing at sparkling fish colors stretching in the warmth of the sand dance emergency soundings lifting you into a swirling hypnotic erotic gypsy dance faster than your heart can beat your body tangos and untangles some unknown internal universal rhythm rocked by willie and lobos magical musical exaltation...you are alive and well and living on the planet is a wonderful thing <a href=""https://www.last.fm/music/+noredirect/Willie+And+Lobo"">Read more on Last.fm</a>",4789,17425,Lara & Reyes,Oscar Lopez,Chuscales
Aníbal Troilo,tango,track,Barrio de Tango,2000,41wtEQhLr0jODanJLUqz40,"Aníbal Troilo (July 11, 1914 - May 18, 1975) was an Argentine tango musician. He is said to be the bandoneon player who defined the instrument for his generation. His orchestra was among the most preferred by social dancers during the golden age, but he shifted to an intellectualized concert sound by the 1950s. The Troilo orchestra is best known for its instrumentals, but it also recorded with many vocalists. The Troilo orchestra recorded tangos with rhythmic, smooth, lyrical and concert-era sounds. <a href=""https://www.last.fm/music/+noredirect/An%C3%ADbal+Troilo"">Read more on Last.fm</a>",45120,291626,Miguel Caló,Francisco Canaro,Osvaldo Fresedo
Héctor Gagliardi,tango,track,Me Llamo Tango,2000,0uVy0a0sbQfk9Wyiaf1xgg," <a href=""https://www.last.fm/music/+noredirect/H%C3%A9ctor+Gagliardi"">Read more on Last.fm</a>",54,398,Hector Gagliardi,Alfredo De Angelis,Nelly Omar
El Yoyo,tango,track,Alhambra - Tangos,2000,2AGUYZm1cL2pN5scjgiNGA," <a href=""https://www.last.fm/music/El+Yoyo"">Read more on Last.fm</a>",48,165,Dukela,Las Tatis,El TARASCO
Nelly Omar,tango,track,Barrio de tango,2000,2RuMObTjPQ4myH1TJzCAUh,"Nilda Elvira Vattuone (n. Guaminí, 10 de septiembre de 1911), mejor conocida en el ámbito artístico por su seudónimo Nelly Omar, es una compositora, actriz y cantante argentina de tango y folclore. A pesar de que inició su carrera artística en 1924, su período de esplendor ocurrió en los años 1930 y 1940, destacándose por sus versiones de «Callecita mía», «Sólo para ti», «Latido tras latido» e «Intriga y pasión». Fue llamada «La Gardel con polleras» y el actor Enrique de Rosas la definió como «La voz diferente». <a href=""https://www.last.fm/music/Nelly+Omar"">Read more on Last.fm</a>",8246,42124,Edmundo Rivero,Tita Merello,Ignacio Corsini
Astor Piazzolla,tango,track,Orgullo Criollo,2000,32vScW9TKKuzkXg5PRRgt9,"Astor Piazzolla (March 11, 1921 – July 4, 1992) was an Argentine tango composer and bandoneón player. His oeuvre revolutionized the traditional tango into a new style termed nuevo tango, incorporating elements from jazz and classical music. An excellent bandoneonist, he regularly performed his own compositions with different ensembles. He is known in his native land as ""El Gran Astor"" (""The Great Astor""). Ástor Pantaleón Piazzolla was born in Mar del Plata <a href=""https://www.last.fm/music/Astor+Piazzolla"">Read more on Last.fm</a>",416384,6715369,Roberto Goyeneche,Carlos Gardel,Osvaldo Pugliese
Carlos Gardel,tango,track,Melodía De Arrabal,2000,54ZisxXxZ8lntug7COmKWb,"Carlos Gardel (born Charles Romuald Gardes; 11 December 1890 – 24 June 1935) was an Argentine tango singer, songwriter, composer and actor, and is perhaps the most prominent figure in the history of tango. Gardel died in an airplane crash at the height of his career, becoming an archetypal tragic hero mourned throughout Latin America. For many, Gardel embodies the soul of the tango style. He is commonly referred to as ""Carlitos"", ""El Zorzal"" (The Song Thrush) <a href=""https://www.last.fm/music/Carlos+Gardel"">Read more on Last.fm</a>",230365,2489554,Roberto Goyeneche,Julio Sosa,Juan D'Arienzo
Juana Amaya,tango,track,Rumbas con Guitarra = 184,2000,2ImhxNXwSsVPlIHMB380en," <a href=""https://www.last.fm/music/Juana+Amaya"">Read more on Last.fm</a>",419,3538,Jose Galvan,Manuel Salado,Adela Campallo
Juana Amaya,tango,track,Rumbas Solo Compás = 200,2000,01GxXKvWNO4HHQNeby6qVd," <a href=""https://www.last.fm/music/Juana+Amaya"">Read more on Last.fm</a>",419,3538,Jose Galvan,Manuel Salado,Adela Campallo
Nacha Guevara,tango,track,Arrabalera,2000,6RxIIoJTItZlptEBhdYxnF,"Nacha Guevara is one of the more prolific, versatile, charismatic, influential, and loved artists. Back in the 70's she performed in New York and shortly after that became well known among the folkloric genre in Mexico and the rest of the Americas. Originally a dancer converted to actress and ultimately learned to sing she rose to become a strong pillar in the latin-american music . One of the most known and remembered songs in U. S. is that one that recites ""Don't cry for me Argentina"". <a href=""https://www.last.fm/music/Nacha+Guevara"">Read more on Last.fm</a>",6695,56143,Liliana Herrero,Silvia Iriondo,Alberto Rojo
Juana Amaya,tango,track,Rumbas con Guitarra = 200,2000,1kvulwZJBVcKtse5o8PYfo," <a href=""https://www.last.fm/music/Juana+Amaya"">Read more on Last.fm</a>",419,3538,Jose Galvan,Manuel Salado,Adela Campallo
Nacha Guevara,tango,track,Yira yira,2000,6CNbGRygTBGtkk4LIFkSEc,"Nacha Guevara is one of the more prolific, versatile, charismatic, influential, and loved artists. Back in the 70's she performed in New York and shortly after that became well known among the folkloric genre in Mexico and the rest of the Americas. Originally a dancer converted to actress and ultimately learned to sing she rose to become a strong pillar in the latin-american music . One of the most known and remembered songs in U. S. is that one that recites ""Don't cry for me Argentina"". <a href=""https://www.last.fm/music/Nacha+Guevara"">Read more on Last.fm</a>",6695,56143,Liliana Herrero,Silvia Iriondo,Alberto Rojo
Carlos Gardel,tango,track,Adios Muchachos,2000,233eZM9BSR8fSnNDzUnTS7,"Carlos Gardel (born Charles Romuald Gardes; 11 December 1890 – 24 June 1935) was an Argentine tango singer, songwriter, composer and actor, and is perhaps the most prominent figure in the history of tango. Gardel died in an airplane crash at the height of his career, becoming an archetypal tragic hero mourned throughout Latin America. For many, Gardel embodies the soul of the tango style. He is commonly referred to as ""Carlitos"", ""El Zorzal"" (The Song Thrush) <a href=""https://www.last.fm/music/Carlos+Gardel"">Read more on Last.fm</a>",230365,2489554,Roberto Goyeneche,Julio Sosa,Juan D'Arienzo
Carlos Gardel,tango,track,Lejana Tierra Mía,2000,5cq1uSb2Km4kwEjSy2KCX4,"Carlos Gardel (born Charles Romuald Gardes; 11 December 1890 – 24 June 1935) was an Argentine tango singer, songwriter, composer and actor, and is perhaps the most prominent figure in the history of tango. Gardel died in an airplane crash at the height of his career, becoming an archetypal tragic hero mourned throughout Latin America. For many, Gardel embodies the soul of the tango style. He is commonly referred to as ""Carlitos"", ""El Zorzal"" (The Song Thrush) <a href=""https://www.last.fm/music/Carlos+Gardel"">Read more on Last.fm</a>",230365,2489554,Roberto Goyeneche,Julio Sosa,Juan D'Arienzo
Cuarteto Argentino De Tango,tango,track,Nocturna,2000,5U751fRQzYCLn4bvevWURJ," <a href=""https://www.last.fm/music/Cuarteto+Argentino+De+Tango"">Read more on Last.fm</a>",1494,5148,Beba Pugliese,"Mosalini Juan José, Caratini Patrice, Beytelmann Gustavo",Orquesta Típica Tangarte
Carlos Gardel,tango,track,El Dia Que Me Quieras - Bonus Track,2000,4iQIGVJBdbQeg8Voph3har,"Carlos Gardel (born Charles Romuald Gardes; 11 December 1890 – 24 June 1935) was an Argentine tango singer, songwriter, composer and actor, and is perhaps the most prominent figure in the history of tango. Gardel died in an airplane crash at the height of his career, becoming an archetypal tragic hero mourned throughout Latin America. For many, Gardel embodies the soul of the tango style. He is commonly referred to as ""Carlitos"", ""El Zorzal"" (The Song Thrush) <a href=""https://www.last.fm/music/Carlos+Gardel"">Read more on Last.fm</a>",230365,2489554,Roberto Goyeneche,Julio Sosa,Juan D'Arienzo
Dmitri Shostakovich,tango,track,"The Bolt, Suite from the Ballet, Op. 27a - Ballet Suite No. 5: Tango - 1931 Version",2000,7swhpoD7Y098lkzKOhNLx2,"Dmitri Dmitriyevich Shostakovich (Russian: Дмитрий Дмитриевич Шостакович) (September 25 [O.S. September 12] 1906, (St Petersburg, Russia) – August 9, 1975) was a Russian composer of the Soviet period. Shostakovich had a complex and difficult relationship with the Soviet government, suffering two official denunciations of his music, in 1936 and 1948, and the periodic banning of his work. At the same time, he received a number of accolades and state awards and served in the Supreme Soviet. <a href=""https://www.last.fm/music/Dmitri+Shostakovich"">Read more on Last.fm</a>",983539,11429998,Sergei Prokofiev,Sergei Rachmaninoff,Johannes Brahms
Grupo de María del Mar Moreno,tango,track,Tarantos con baile flamenco parte de tangos,2000,4VvrwDpyTSfY1jndDfKz1m," <a href=""https://www.last.fm/music/Grupo+de+Mar%C3%ADa+Del+Mar+Moreno"">Read more on Last.fm</a>",103,835,Grupo de Eva La Yerbabuena,Manuel Salado,Grupo de Juana Amaya
El Agujetas,tango,track,Viejo Cante por Tangos,2000,4h9ouHUoUOKHwpDamlb5uX,"Manuel de los Santos Pastor, also known as El Agujetas or el El Agujeta, (May 17, 1939 – December 25, 2015) was a Flamenco singer. He was born in Rota, Spain. Son of singer Agujetas el Viejo. Both father and son follow the school of Manuel Torre, representative of the tradition of Jerez, and father of singers Dolores Agujetas and Antonio Agujetas. He worked in his father's forge until he went to work in Madrid as a teenager. He took part in the recording of the Magna Antología del Cante, compiled by Blas Vega. <a href=""https://www.last.fm/music/El+Agujetas"">Read more on Last.fm</a>",1657,16435,Manuel Agujetas,Tia Anica La Piriñaca,Agujetas
Igor Stravinsky,tango,track,L´histoire du soldat: IV. Tango - Valse - Ragtime,2000,2HdwsgTmPkYNVhImpRiic8,"Igor Fyodorovich Stravinsky (Russian: Игорь Ѳёдоровичъ Стравинскій) (17th June 1882 – 6th April 1971) was a Russian composer who first achieved international fame with three ballets commissioned by the impresario Serge Diaghilev and performed by Diaghilev's Ballets Russes (Russian Ballet): L'Oiseau de feu (""The Firebird"") (1910), Petrushka (1911), and Le sacre du printemps (""The Rite of Spring"") (1913). Stravinsky's compositional career was notable for its stylistic diversity. <a href=""https://www.last.fm/music/Igor+Stravinsky"">Read more on Last.fm</a>",610389,8114591,Sergei Prokofiev,Gustav Mahler,Arnold Schönberg
Igor Stravinsky,tango,track,"Histoire du soldat (suite pour violon, clarinette et piano): IV. Tango; valse; ragtime",2000,2RwWxATIc6IjrcuELOrVKg,"Igor Fyodorovich Stravinsky (Russian: Игорь Ѳёдоровичъ Стравинскій) (17th June 1882 – 6th April 1971) was a Russian composer who first achieved international fame with three ballets commissioned by the impresario Serge Diaghilev and performed by Diaghilev's Ballets Russes (Russian Ballet): L'Oiseau de feu (""The Firebird"") (1910), Petrushka (1911), and Le sacre du printemps (""The Rite of Spring"") (1913). Stravinsky's compositional career was notable for its stylistic diversity. <a href=""https://www.last.fm/music/Igor+Stravinsky"">Read more on Last.fm</a>",610389,8114591,Sergei Prokofiev,Gustav Mahler,Arnold Schönberg
Familia Montoya,tango,album,Tangos de la Virgen,2000,1UfHNoJ0h0xwiuiR3kOoRM," <a href=""https://www.last.fm/music/Familia+Montoya"">Read more on Last.fm</a>",94,533,El Agujetas,Fernanda de Utrera,Ramón El Portugués
Orquestra Romântica Brasileira,tango,album,Tangos Solamente Tangos,2000,4lsaIEJyFRvOVJZiewm4z5," <a href=""https://www.last.fm/music/+noredirect/Orquestra+Rom%C3%A2ntica+Brasileira"">Read more on Last.fm</a>",996,12110,Kike Fernández,Miguel Nacel,Orquesta Raiz Latina
Carlos Di Sarli,tango,album,Solo Tango: Carlos Di Sarli - Instrumental Vol. 1,2000,6tGetlLmTbL1Y4B9YE8bxy,"Carlos Di Sarli (January 7, 1903 - January 12, 1960) was an Argentine tango musician, orchestra leader, composer and pianist. Before starting his own tango orchestra, he played in Osvaldo Fresedo's orchestra. He developed smooth, clean-sounding, powerful arrangements which his Orquesta típica and recorded 27 albums and 512 recordings are reported. His music is widely used by learner dancers because of its easy, danceable sound, and is played regularly in milongas for social tango dancing. <a href=""https://www.last.fm/music/Carlos+Di+Sarli"">Read more on Last.fm</a>",24950,403703,Francisco Canaro,Rodolfo Biagi,Miguel Caló
Cuarteto Guardia Vieja,tango,album,Tangos valses y milongas inolvidables,2000,6f1NVnCh7UlaeTQadBh8nS," <a href=""https://www.last.fm/music/Cuarteto+Guardia+Vieja"">Read more on Last.fm</a>",998,3864,Orquesta Tipica Victor,Francisco Canaro,Agustín Magaldi
Orquesta Cuerdas Latinas,tango,album,Tangos Inolvidables,2000,6NMO2Zjpbu9iQS7VXQKjkD," <a href=""https://www.last.fm/music/Orquesta+Cuerdas+Latinas"">Read more on Last.fm</a>",633,2184,Aldo Livorno y su acordeón Napolitano,Cuerdas Y Metales,Orquesta Cuerdas Y Metales
Aníbal Troilo,tango,album,Tangos Para Bailar - Documentos Tango,2000,6aaYjATKNncLnFvgK2cmUP,"Aníbal Troilo (July 11, 1914 - May 18, 1975) was an Argentine tango musician. He is said to be the bandoneon player who defined the instrument for his generation. His orchestra was among the most preferred by social dancers during the golden age, but he shifted to an intellectualized concert sound by the 1950s. The Troilo orchestra is best known for its instrumentals, but it also recorded with many vocalists. The Troilo orchestra recorded tangos with rhythmic, smooth, lyrical and concert-era sounds. <a href=""https://www.last.fm/music/+noredirect/An%C3%ADbal+Troilo"">Read more on Last.fm</a>",45120,291626,Miguel Caló,Francisco Canaro,Osvaldo Fresedo
Angel D'Agostino,tango,album,Solo Tango: A. D'Agostino - A. Vargas Vol 1,2000,34jN5GdaTkxyJFR7FfdcpC,"Angel Domingo Emilio D'Agostino (Buenos Aires, May 25, 1900 - January 16, 1991) was an Argentine tango pianist and composer. He played piano as a child and he studied at the conservatory and began very young to perform in public with a trio, in with also Juan D'Arienzo. In 1920, hired by the Palais de Glace, he formed his own orchestra. They played tango and jazz and accompanied silent films. In 1932 he met Angel Vargas. In 1934 he formed an orchestra dedicated exclusively to tango <a href=""https://www.last.fm/music/Angel+D%27agostino"">Read more on Last.fm</a>",4572,40123,Ricardo Tanturi,Adolfo Carabelli,Rodolfo Biagi
Gran Orquesta Cuerdas Latinas,tango,album,Tangos Inolvidables,2000,2HjkLATFBxIjmFngcrujnJ," <a href=""https://www.last.fm/music/Gran+Orquesta+Cuerdas+Latinas"">Read more on Last.fm</a>",13,156,,,
Juana Amaya,tango,album,Sólo Compás - Tangos y Rumbas (Vol. 2),2000,3Iw3YkcG2XBjbSbPbAhlHF," <a href=""https://www.last.fm/music/Juana+Amaya"">Read more on Last.fm</a>",419,3538,Jose Galvan,Manuel Salado,Adela Campallo
